{
  "schemaVersion": "1.0",
  "idempotencyKey": "00000000-0000-4000-8000-000000000001",
  "source": {
    "system": "saas-ui",
    "tenantId": "11111111-1111-4111-8111-111111111111"
  },
  "document": {
    "ddmVersion": "1.0",
    "docType": "policy_paper",
    "metadata": {
      "title": "Regional Stability Brief",
      "date": "2026-05-29",
      "status": "final"
    },
    "classification": {
      "scheme": "none",
      "level": "UNCLASSIFIED"
    },
    "sections": [
      {
        "id": "s-su",
        "role": "summary",
        "heading": "Summary",
        "level": 1,
        "blocks": [
          {
            "id": "b1",
            "type": "paragraph",
            "text": "Summary."
          }
        ]
      },
      {
        "id": "s-pr",
        "role": "problem",
        "heading": "Problem",
        "level": 1,
        "blocks": [
          {
            "id": "b2",
            "type": "paragraph",
            "text": "Problem."
          }
        ]
      },
      {
        "id": "s-ev",
        "role": "evidence",
        "heading": "Evidence",
        "level": 1,
        "blocks": [
          {
            "id": "b3",
            "type": "paragraph",
            "text": "Evidence.",
            "style": "normal"
          },
          {
            "id": "b3r",
            "type": "reference",
            "citeId": "c1"
          }
        ]
      },
      {
        "id": "s-oa",
        "role": "options_analysis",
        "heading": "Options Analysis",
        "level": 1,
        "blocks": [
          {
            "id": "b4",
            "type": "table",
            "columns": [
              {
                "key": "o",
                "label": "Option"
              }
            ],
            "rows": [
              [
                {
                  "text": "A"
                }
              ]
            ]
          }
        ]
      },
      {
        "id": "s-rec",
        "role": "recommendation",
        "heading": "Recommendation",
        "level": 1,
        "blocks": [
          {
            "id": "b5",
            "type": "paragraph",
            "text": "Adopt A."
          }
        ]
      }
    ],
    "citations": [
      {
        "id": "c1",
        "type": "dataset",
        "title": "Dataset X",
        "url": "https://example.org/x"
      }
    ]
  },
  "outputs": [
    "pdf"
  ],
  "delivery": {
    "mode": "async",
    "storage": "signed_url",
    "ttlSeconds": 604800
  }
}