{
  "schemaVersion": "1.0",
  "idempotencyKey": "00000000-0000-4000-8000-000000000001",
  "source": {
    "system": "saas-ui",
    "tenantId": "11111111-1111-4111-8111-111111111111"
  },
  "document": {
    "ddmVersion": "1.0",
    "docType": "executive_briefing",
    "metadata": {
      "title": "Regional Stability Brief",
      "date": "2026-05-29",
      "status": "final"
    },
    "classification": {
      "scheme": "none",
      "level": "UNCLASSIFIED"
    },
    "sections": [
      {
        "id": "s-sum",
        "role": "executive_summary",
        "heading": "Executive Summary",
        "level": 1,
        "blocks": [
          {
            "id": "b1",
            "type": "paragraph",
            "text": "BLUF: situation stable.",
            "style": "lead"
          }
        ]
      },
      {
        "id": "s-kj",
        "role": "key_judgements",
        "heading": "Key Judgements",
        "level": 1,
        "blocks": [
          {
            "id": "b2",
            "type": "bullets",
            "ordered": true,
            "items": [
              {
                "text": "Judgement one."
              },
              {
                "text": "Judgement two."
              }
            ]
          }
        ]
      },
      {
        "id": "s-an",
        "role": "analysis",
        "heading": "Analysis",
        "level": 1,
        "blocks": [
          {
            "id": "b3",
            "type": "paragraph",
            "text": "Analysis body."
          },
          {
            "id": "b5",
            "type": "table",
            "caption": "Comparison",
            "columns": [
              {
                "key": "opt",
                "label": "Option"
              },
              {
                "key": "cost",
                "label": "Cost",
                "align": "right"
              }
            ],
            "rows": [
              [
                {
                  "text": "A"
                },
                {
                  "text": "Low"
                }
              ],
              [
                {
                  "text": "B"
                },
                {
                  "text": "High"
                }
              ]
            ]
          },
          {
            "id": "b6",
            "type": "chart",
            "chartType": "bar",
            "caption": "Trend",
            "spec": {
              "xKey": "month",
              "series": [
                {
                  "key": "v",
                  "label": "Value"
                }
              ],
              "data": [
                {
                  "month": "Jan",
                  "v": 3
                },
                {
                  "month": "Feb",
                  "v": 5
                }
              ]
            }
          },
          {
            "id": "b7",
            "type": "kpi",
            "items": [
              {
                "label": "Readiness",
                "value": "82",
                "unit": "%",
                "trend": "up"
              }
            ]
          },
          {
            "id": "b8",
            "type": "callout",
            "style": "risk",
            "text": "Escalation risk in Q3."
          },
          {
            "id": "b9",
            "type": "reference",
            "citeId": "c1"
          }
        ]
      },
      {
        "id": "s-rec",
        "role": "recommendation",
        "heading": "Recommendation",
        "level": 1,
        "blocks": [
          {
            "id": "b4",
            "type": "callout",
            "style": "recommendation",
            "text": "Proceed with option A."
          }
        ]
      },
      {
        "id": "s-app",
        "kind": "appendix",
        "role": "appendices",
        "heading": "Methodology",
        "level": 1,
        "blocks": [
          {
            "id": "b10",
            "type": "image",
            "evidenceId": "e1",
            "altText": "map of region",
            "caption": "Region map"
          }
        ]
      }
    ],
    "citations": [
      {
        "id": "c1",
        "type": "web",
        "title": "Source A",
        "url": "https://example.org/a"
      },
      {
        "id": "c2",
        "type": "document",
        "title": "Source B"
      }
    ],
    "evidence": [
      {
        "id": "e1",
        "kind": "image",
        "storageRef": "evidence/e1.png",
        "altText": "map",
        "sha256": "aaaaaaaaaaaaaaaaaaaaaaaaaaaaaaaaaaaaaaaaaaaaaaaaaaaaaaaaaaaaaaaa"
      }
    ]
  },
  "outputs": [
    "pdf",
    "docx"
  ],
  "delivery": {
    "mode": "async",
    "storage": "signed_url",
    "ttlSeconds": 604800,
    "callbackUrl": "https://emergency-ai.example/cb",
    "callbackAuth": {
      "type": "hmac"
    }
  }
}